{
  "schemaVersion": "1.0",
  "metadata": {
    "nombre": "Catalogo semilla de reglas de portabilidad Windows -> Linux (.NET 8)",
    "descripcion": "Reglas data-driven para el analisis estatico IL (Mono.Cecil) de la solucion WPF/Oracle. Cada regla identifica una dependencia potencial del sistema operativo Windows y su ruta de portabilidad a Linux.",
    "generadoPara": "Herramienta de consola C# / .NET 8 descrita en el prompt de analisis de portabilidad",
    "advertencia": "Los esfuerzos son SEMILLA orientativa (heuristica) y deben calibrarse con datos reales del equipo. La disponibilidad exacta de cada API en Linux depende de la version de .NET y de los paquetes NuGet en uso: verificar contra la version objetivo.",
    "notasDeUso": "matchMode: 'equals' (exacto), 'startsWith' (prefijo, util para namespaces/assemblies), 'contains', 'regex'. patron.tipo indica como aplica el detector: pInvokeDll | assemblyReference | namespace | type | method | attribute | apiCall | stringLiteral."
  },
  "modeloEsfuerzo": {
    "unidad": "horas-persona",
    "granularidad": "Por cluster de hallazgos del mismo tipo dentro de un mismo ensamblado (NO multiplicar linealmente por cada ocurrencia).",
    "formulaMedia": "media = (optimista + 4*masProbable + pesimista) / 6",
    "agregacion": "Sumar O, masProbable y P por ensamblado y por proyecto; la media agregada usa la formula PERT sobre las sumas.",
    "factorIncertidumbreTerceros": 1.5,
    "notaIncertidumbre": "Aplicar el factor de incertidumbre a ensamblados de terceros, ofuscados o marcados como 'no analizable', y declararlo en el informe.",
    "leyendaConfianza": {
      "Alta": "Deteccion deterministica (atributo, DllImport, referencia de ensamblado explicita).",
      "Media": "Deteccion por patron de API o namespace; posibles falsos positivos segun uso real.",
      "Baja": "Heuristica textual (literales de cadena, rutas); revision manual recomendada."
    }
  },
  "severidades": ["Info", "Bajo", "Medio", "Alto", "Bloqueante"],
  "categorias": {
    "PInvoke": "Llamadas nativas via DllImport a bibliotecas del sistema Windows.",
    "COM": "Interoperabilidad COM/OLE, propia de Windows.",
    "AssemblyReference": "Referencia a ensamblados gestionados solo compatibles con Windows.",
    "PlatformAttribute": "Atributos de anotacion de plataforma del SDK.",
    "Registry": "Acceso al Registro de Windows.",
    "Cryptography": "APIs criptograficas ligadas a CryptoAPI/CNG/DPAPI/almacen de certificados de Windows.",
    "Identity": "Autenticacion e identidad de Windows (SSPI/AD).",
    "Threading": "Modelos de hilos/sincronizacion con semantica dependiente de Windows.",
    "ProcessInvocation": "Invocacion de comandos o ejecutables del sistema operativo.",
    "FileSystem": "Supuestos del sistema de ficheros de Windows (unidades, separadores, carpetas especiales).",
    "Database": "Controladores de base de datos dependientes de la plataforma.",
    "Misc": "Otras dependencias menores o de senal debil."
  },
  "reglas": [
    {
      "id": "PINVOKE-KERNEL32",
      "categoria": "PInvoke",
      "descripcion": "DllImport a kernel32.dll (gestion de procesos, memoria, ficheros, handles nativos).",
      "patron": { "tipo": "pInvokeDll", "valor": "kernel32", "matchMode": "startsWith" },
      "severidad": "Alto",
      "esBloqueante": false,
      "alternativaLinux": "Sustituir por APIs gestionadas equivalentes (System.IO, System.Diagnostics, System.Runtime.InteropServices en su version multiplataforma) o P/Invoke condicional por SO.",
      "esfuerzo": { "optimista": 1, "masProbable": 4, "pesimista": 12 },
      "confianza": "Alta"
    },
    {
      "id": "PINVOKE-USER32",
      "categoria": "PInvoke",
      "descripcion": "DllImport a user32.dll (ventanas, mensajes, entrada de UI). Fuertemente ligado a la GUI de Windows.",
      "patron": { "tipo": "pInvokeDll", "valor": "user32", "matchMode": "startsWith" },
      "severidad": "Bloqueante",
      "esBloqueante": true,
      "alternativaLinux": "No portable directamente: funcionalidad de UI Win32. Requiere rediseno de la capa de presentacion o eliminacion de la dependencia en la libreria de negocio.",
      "esfuerzo": { "optimista": 4, "masProbable": 16, "pesimista": 60 },
      "confianza": "Alta"
    },
    {
      "id": "PINVOKE-GDI32",
      "categoria": "PInvoke",
      "descripcion": "DllImport a gdi32.dll (dibujo GDI). Dependiente de Windows.",
      "patron": { "tipo": "pInvokeDll", "valor": "gdi32", "matchMode": "startsWith" },
      "severidad": "Alto",
      "esBloqueante": false,
      "alternativaLinux": "Sustituir grafico por SkiaSharp o ImageSharp (multiplataforma).",
      "esfuerzo": { "optimista": 3, "masProbable": 12, "pesimista": 40 },
      "confianza": "Alta"
    },
    {
      "id": "PINVOKE-ADVAPI32",
      "categoria": "PInvoke",
      "descripcion": "DllImport a advapi32.dll (registro, servicios, seguridad, criptografia CAPI).",
      "patron": { "tipo": "pInvokeDll", "valor": "advapi32", "matchMode": "startsWith" },
      "severidad": "Alto",
      "esBloqueante": false,
      "alternativaLinux": "Reemplazar por equivalentes gestionados (configuracion externa en vez de registro, System.Security.Cryptography portable, etc.).",
      "esfuerzo": { "optimista": 2, "masProbable": 8, "pesimista": 24 },
      "confianza": "Alta"
    },
    {
      "id": "PINVOKE-OLE32",
      "categoria": "PInvoke",
      "descripcion": "DllImport a ole32.dll (infraestructura COM/OLE).",
      "patron": { "tipo": "pInvokeDll", "valor": "ole32", "matchMode": "startsWith" },
      "severidad": "Bloqueante",
      "esBloqueante": true,
      "alternativaLinux": "COM no existe en Linux: eliminar la dependencia o abstraer el servicio detras de una interfaz multiplataforma.",
      "esfuerzo": { "optimista": 4, "masProbable": 16, "pesimista": 50 },
      "confianza": "Alta"
    },
    {
      "id": "PINVOKE-OLEAUT32",
      "categoria": "PInvoke",
      "descripcion": "DllImport a oleaut32.dll (automatizacion OLE, VARIANT, BSTR).",
      "patron": { "tipo": "pInvokeDll", "valor": "oleaut32", "matchMode": "startsWith" },
      "severidad": "Bloqueante",
      "esBloqueante": true,
      "alternativaLinux": "Automatizacion OLE no disponible en Linux: rediseno necesario.",
      "esfuerzo": { "optimista": 4, "masProbable": 16, "pesimista": 50 },
      "confianza": "Alta"
    },
    {
      "id": "PINVOKE-SHELL32",
      "categoria": "PInvoke",
      "descripcion": "DllImport a shell32.dll (shell de Windows, iconos, rutas especiales).",
      "patron": { "tipo": "pInvokeDll", "valor": "shell32", "matchMode": "startsWith" },
      "severidad": "Medio",
      "esBloqueante": false,
      "alternativaLinux": "Sustituir por Environment.GetFolderPath / APIs gestionadas o logica especifica por SO.",
      "esfuerzo": { "optimista": 1, "masProbable": 4, "pesimista": 12 },
      "confianza": "Alta"
    },
    {
      "id": "PINVOKE-COMDLG32",
      "categoria": "PInvoke",
      "descripcion": "DllImport a comdlg32.dll (dialogos comunes de Windows: abrir/guardar).",
      "patron": { "tipo": "pInvokeDll", "valor": "comdlg32", "matchMode": "startsWith" },
      "severidad": "Bloqueante",
      "esBloqueante": true,
      "alternativaLinux": "Dialogos Win32 no portables: parte de la UI, gestionar en la capa de presentacion multiplataforma.",
      "esfuerzo": { "optimista": 2, "masProbable": 8, "pesimista": 24 },
      "confianza": "Alta"
    },
    {
      "id": "PINVOKE-COMCTL32",
      "categoria": "PInvoke",
      "descripcion": "DllImport a comctl32.dll (controles comunes de Windows).",
      "patron": { "tipo": "pInvokeDll", "valor": "comctl32", "matchMode": "startsWith" },
      "severidad": "Bloqueante",
      "esBloqueante": true,
      "alternativaLinux": "Controles Win32 no portables: parte de la UI.",
      "esfuerzo": { "optimista": 2, "masProbable": 8, "pesimista": 24 },
      "confianza": "Alta"
    },
    {
      "id": "PINVOKE-WINMM",
      "categoria": "PInvoke",
      "descripcion": "DllImport a winmm.dll (multimedia, sonido, temporizadores Windows).",
      "patron": { "tipo": "pInvokeDll", "valor": "winmm", "matchMode": "startsWith" },
      "severidad": "Medio",
      "esBloqueante": false,
      "alternativaLinux": "Sustituir por libreria multimedia multiplataforma o temporizadores gestionados (System.Threading / PeriodicTimer).",
      "esfuerzo": { "optimista": 1, "masProbable": 6, "pesimista": 20 },
      "confianza": "Alta"
    },
    {
      "id": "PINVOKE-CRYPT32",
      "categoria": "PInvoke",
      "descripcion": "DllImport a crypt32.dll (almacen de certificados y CryptoAPI de Windows).",
      "patron": { "tipo": "pInvokeDll", "valor": "crypt32", "matchMode": "startsWith" },
      "severidad": "Alto",
      "esBloqueante": false,
      "alternativaLinux": "Reemplazar por System.Security.Cryptography portable; el almacen de certificados en Linux se basa en OpenSSL/ficheros PEM.",
      "esfuerzo": { "optimista": 3, "masProbable": 10, "pesimista": 30 },
      "confianza": "Alta"
    },
    {
      "id": "PINVOKE-SETUPAPI",
      "categoria": "PInvoke",
      "descripcion": "DllImport a setupapi.dll (enumeracion de dispositivos/drivers de Windows).",
      "patron": { "tipo": "pInvokeDll", "valor": "setupapi", "matchMode": "startsWith" },
      "severidad": "Bloqueante",
      "esBloqueante": true,
      "alternativaLinux": "Enumeracion de dispositivos especifica de Windows: en Linux usar sysfs/udev; rediseno necesario.",
      "esfuerzo": { "optimista": 4, "masProbable": 16, "pesimista": 50 },
      "confianza": "Alta"
    },
    {
      "id": "PINVOKE-NETAPI32",
      "categoria": "PInvoke",
      "descripcion": "DllImport a netapi32.dll (gestion de red/dominio de Windows).",
      "patron": { "tipo": "pInvokeDll", "valor": "netapi32", "matchMode": "startsWith" },
      "severidad": "Bloqueante",
      "esBloqueante": true,
      "alternativaLinux": "Funciones de red de dominio Windows no portables.",